{
  "id": "dyk",
  "name": "Dyk",
  "repository": {
    "github": "netbka/Dyk",
    "localRoot": "D:\\Git\\Dyk"
  },
  "lifecycle": "active",
  "capabilities": [
    "ui",
    "storybook",
    "public-web",
    "api",
    "worker",
    "database",
    "docker",
    "ai",
    "payments",
    "auth",
    "seo",
    "email"
  ],
  "environments": [
    "local",
    "dev",
    "prod"
  ],
  "resources": {
    "compute": [
      {
        "name": "Netcup shared VPS",
        "kind": "vps",
        "status": "observed",
        "environment": "prod",
        "notes": "Docker Compose project dyk on shared host"
      }
    ],
    "databases": [
      {
        "name": "SQL Server",
        "kind": "sqlserver",
        "status": "observed",
        "notes": "Application database"
      },
      {
        "name": "Evolution PostgreSQL",
        "kind": "postgres",
        "status": "observed",
        "environment": "prod"
      },
      {
        "name": "Evolution Redis",
        "kind": "redis",
        "status": "observed",
        "environment": "prod"
      }
    ],
    "providers": [
      {
        "name": "OpenAI",
        "kind": "ai",
        "status": "observed"
      },
      {
        "name": "Google",
        "kind": "oauth",
        "status": "observed"
      },
      {
        "name": "Yandex",
        "kind": "oauth",
        "status": "observed"
      },
      {
        "name": "Telegram Login",
        "kind": "oauth",
        "status": "observed"
      },
      {
        "name": "Telegram source",
        "kind": "external-api",
        "status": "observed"
      },
      {
        "name": "PayPal",
        "kind": "payments",
        "status": "observed"
      },
      {
        "name": "Paddle",
        "kind": "payments",
        "status": "parked"
      },
      {
        "name": "YooKassa",
        "kind": "payments",
        "status": "observed"
      },
      {
        "name": "SMTP",
        "kind": "email",
        "status": "observed"
      },
      {
        "name": "WAHA",
        "kind": "whatsapp",
        "status": "observed"
      },
      {
        "name": "Evolution API",
        "kind": "whatsapp",
        "status": "observed"
      },
      {
        "name": "Google Search Console",
        "kind": "seo",
        "status": "unknown",
        "notes": "Roadmap records owner action still required"
      }
    ],
    "domains": [
      {
        "name": "pidyk.app",
        "kind": "public-domain",
        "status": "observed",
        "environment": "prod"
      }
    ],
    "backups": [
      {
        "name": "Netcup local backup",
        "kind": "host-backup",
        "status": "observed",
        "environment": "prod",
        "notes": "Daily/14-day policy documented"
      },
      {
        "name": "Off-host backup",
        "kind": "object-storage",
        "status": "planned",
        "notes": "Current documented gap; provider to be selected/verified"
      }
    ]
  },
  "secrets": {
    "current": "Workstation .env with scoped SSH push to Netcup",
    "target": "Infisical project/environment/runtime isolation",
    "notes": "Do not copy values into registry."
  },
  "notes": [
    "Dyk Storybook v2 is the reference implementation for shared-renderer UI governance.",
    "Production persistent Docker state uses host bind mounts.",
    "Production deploys: deploy/AGENTS.md grants standing authorization for assigned changes to Dyk's own target with release evidence, verification, isolation and rollback gates binding. Owner decision netbka/engineering-platform#82 accepted this form and retired the per-deploy owner trigger.",
    "Open request (#82): remove the git push origin main and one-off ssh rm -rf allowances from .claude/settings.json; they contradict Dyk principle P1.",
    "Observed, not verified: the change manifest rejects controller-only evidence (GOV-16). The independent verifier gate stays not-enabled until verified, because enabling it is a one-way ratchet.",
    "Browser-driven tests are banned; screenshots and browser review are review evidence, not tests (AGENTS.md section 8). A project method choice, not a tightening of a generic rule."
  ],
  "governance": {
    "observedAt": "netbka/Dyk@b32d081aa935cd0531fcb4fd7a2f51ed987802d4",
    "parentLink": "linked",
    "authorities": [
      { "role": "agent-contract", "path": "AGENTS.md" },
      { "role": "product-constitution", "path": "docs/PRODUCT_CONSTITUTION.md" },
      { "role": "principles", "path": "docs/PRINCIPLES.md" },
      { "role": "decisions", "path": "docs/DECISIONS.md" },
      { "role": "router", "path": ".agent/capabilities.yaml" },
      { "role": "runtime-state", "path": "docs/STATE.md" },
      { "role": "workflow-contract", "path": "testing/workflows" },
      { "role": "experience-review", "path": "docs/EXPERIENCE_REVIEW.md" },
      { "role": "ui-authority", "path": "storybook/review-manifest.json" }
    ],
    "ownerReserved": [
      {
        "id": "product-authority-change",
        "kind": "permanent",
        "source": "docs/PRINCIPLES.md#owner-reserved-matters",
        "summary": "Changing the Product Constitution or PRINCIPLES."
      },
      {
        "id": "billing-provider",
        "kind": "permanent",
        "source": "docs/PRINCIPLES.md#owner-reserved-matters",
        "summary": "Choosing the billing provider."
      },
      {
        "id": "visible-result-approval",
        "kind": "transitional",
        "source": "docs/DECISIONS.md#d-040",
        "summary": "Owner approves a new visible result in Storybook before production implementation.",
        "retiresWhen": "Dyk design gate (principle check, customer-eye review, screenshots) is live and an owner-merged change records it in docs/STATE.md."
      }
    ],
    "stricter": [
      {
        "rule": "baseline:evidence-truth",
        "source": "docs/PRODUCT_CONSTITUTION.md#5-trust-is-a-hard-product-boundary",
        "summary": "Unsupported or invented facts are a hard product gate, not a tradeable metric."
      },
      {
        "rule": "baseline:isolation",
        "source": "docs/PRINCIPLES.md#s---safety-and-privacy",
        "summary": "Owner or grant is re-checked on the server for every request, job, history load and AI context (S1)."
      },
      {
        "rule": "constitution#4",
        "source": "AGENTS.md#2-route-only-the-selected-context",
        "summary": "A ROADMAP item is not an assignment; an agent never picks the next item itself."
      },
      {
        "rule": "policy:UX-001#interaction-cost-not-click-count",
        "source": "docs/PRINCIPLES.md#u---user-effort",
        "summary": "U2 numeric interaction budgets by goal frequency, measured from where the need is visible."
      },
      {
        "rule": "policy:UX-001#familiar-control-semantics",
        "source": "docs/PRINCIPLES.md#u---user-effort",
        "summary": "44px minimum pointer targets, above the WCAG 2.2 floor."
      }
    ],
    "releaseAuthorization": {
      "source": "deploy/AGENTS.md",
      "approval": "https://github.com/netbka/engineering-platform-archive/issues/82",
      "summary": "Standing deploy authorization for assigned changes to Dyk's own target; release evidence, independent verification, isolation and rollback stay binding."
    },
    "independentVerificationGate": "not-enabled"
  }
}
