{
  "id": "local-commander",
  "name": "Local Commander MCP",
  "repository": {
    "github": "netbka/local-commander-mcp",
    "localRoot": "D:\\Git\\local_commander_mcp"
  },
  "lifecycle": "active",
  "capabilities": [
    "api",
    "mcp",
    "npm-package",
    "ui",
    "storybook",
    "public-web",
    "worker",
    "database",
    "docker",
    "auth",
    "email",
    "payments"
  ],
  "environments": [
    "local",
    "prod"
  ],
  "resources": {
    "compute": [
      {
        "name": "Owner Windows workstation",
        "kind": "local-runtime",
        "status": "observed",
        "notes": "Windows execution node and personal native runtime."
      },
      {
        "name": "Netcup shared VPS",
        "kind": "vps",
        "status": "observed",
        "environment": "prod",
        "notes": "Docker Compose project lcmcp (web and worker, no published host ports) behind the shared edge Caddy on network lcmcp_edge; host shared with Dyk (deploy/cloud/README.md)."
      }
    ],
    "databases": [
      {
        "name": "SQL Server (lcmcp schema)",
        "kind": "sqlserver",
        "status": "observed",
        "environment": "prod",
        "notes": "External to the compose project; separate runtime and migrator identities; immutable applied migrations, no startup migration runner."
      }
    ],
    "providers": [
      {
        "name": "npm registry",
        "kind": "package-registry",
        "status": "observed"
      },
      {
        "name": "Resend SMTP",
        "kind": "email",
        "status": "observed",
        "environment": "prod"
      },
      {
        "name": "PayPal",
        "kind": "payments",
        "status": "observed",
        "notes": "State: off. Observed in code and deploy docs: PAYPAL_ENABLED defaults to false, and deploy/cloud/README.md keeps it and COMMERCIAL_LAUNCH_APPROVED false; commerce belongs to the website release gates. The live setting is not verified."
      },
      {
        "name": "GitHub Actions",
        "kind": "ci",
        "status": "observed",
        "notes": "Path-filtered PR workflows under .github/workflows."
      }
    ],
    "domains": [
      {
        "name": "localcmd.app",
        "kind": "public-domain",
        "status": "observed",
        "environment": "prod",
        "notes": "Public website, account cabinet and OAuth endpoints."
      }
    ],
    "backups": [
      {
        "name": "Edge configuration backup",
        "kind": "host-backup",
        "status": "observed",
        "environment": "prod",
        "notes": "Same-host backup of the shared edge Caddy state; not off-host."
      },
      {
        "name": "SQL backup",
        "kind": "provider-backup",
        "status": "unknown",
        "environment": "prod",
        "notes": "Rests on an owner statement, not on observed code, configuration or provider state: on 2026-10-04 the owner said hosting handles SQL backup (recorded in deploy/LOCALCMD_RELEASE_REPORT.md). Backup history and restore not verified."
      },
      {
        "name": "Off-host disaster recovery",
        "kind": "object-storage",
        "status": "unknown"
      }
    ]
  },
  "secrets": {
    "current": "Local OAuth/runtime credentials outside the repository; on the VPS a runtime environment file plus mounted application data key and OAuth signing key.",
    "target": "Keep human/local identity separated; use scoped machine identities only where remote automation requires them.",
    "notes": "Local Commander must never become the portfolio secret vault. Names only; no values."
  },
  "notes": [
    "Execution model: Full Access authorizes the Windows account's capabilities, with restrictions as owner opt-out (owner decision #104 in the project; accepted as the portfolio model by netbka/engineering-platform#82). Audit stays mandatory, and no agent or model may grant itself permissions.",
    "The engineering-platform delivery supervisor does not use Local Commander as its execution plane; workers are isolated from it.",
    "Product focus per planning/PRODUCT_PRINCIPLES.md F1: agent performance intelligence, with execution as the enabling fabric."
  ],
  "governance": {
    "observedAt": "netbka/local-commander-mcp@4d7ea3cb7907624e3e3d5d250ed86bdfd33a579d",
    "parentLink": "absent",
    "authorities": [
      { "role": "agent-contract", "path": "AGENTS.md" },
      { "role": "product-constitution", "path": "planning/PRODUCT_CONSTITUTION.md" },
      { "role": "principles", "path": "planning/PRODUCT_PRINCIPLES.md" },
      { "role": "decisions", "path": "planning/ARCHITECTURE_DECISIONS.md" },
      { "role": "runtime-state", "path": "planning/ACTIVE_WORK.md" },
      { "role": "capability-contract", "path": "planning/AUTHORIZED_EXECUTION_CONTRACT.md" },
      { "role": "workflow-contract", "path": "planning/ROADMAP_EXECUTOR.md" },
      { "role": "experience-review", "path": "planning/STORYBOOK_EXPERIENCE_REVIEW.md" }
    ],
    "ownerReserved": [
      {
        "id": "security-default-widening",
        "kind": "permanent",
        "source": "planning/PRODUCT_PRINCIPLES.md#owner-reserved-matters",
        "summary": "Security defaults that materially widen execution authority."
      }
    ],
    "gaps": [
      {
        "id": "unrestricted-standing-deploy",
        "rule": "constitution#14",
        "source": "AGENTS.md#permission-boundary",
        "request": "https://github.com/netbka/engineering-platform/issues/82",
        "reviewBy": "2026-11-30",
        "summary": "Standing approval for deploys and shared-database migrations to any destination without restriction; asked to narrow to assigned changes and own targets."
      },
      {
        "id": "tests-on-request",
        "rule": "baseline:independent-verification",
        "source": "AGENTS.md#verify-and-finish",
        "request": "https://github.com/netbka/engineering-platform/issues/82",
        "reviewBy": "2026-11-30",
        "summary": "Suites run only on request and no implementer/verifier split; asked to adopt proportional, independent verification."
      }
    ],
    "independentVerificationGate": "not-enabled"
  }
}
